No,Title,Address,Phone,Rating,Reviews,Type,Hours
1,1001 kopi,"Jl. Sinduadi, Kutu Asem, Sinduadi, Kec. Mlati, Kabupaten Sleman, Daerah Istimewa Yogyakarta 55284",85228281001,4.7,46,Coffee shop,Open ⋅ Closes 11 PM
2,1009 Social Space - Palagan,"Jl. Umbul Permai No.102, Mudal, Sariharjo, Kec. Ngaglik, Kabupaten Sleman, Daerah Istimewa Yogyakarta 55581",81127013869,4.9,"3,636",Cafe,"{Monday, 8.00 am–12.00 am; Tuesday, 8.00 am–12.00 am; Wednesday, 8.00 am–12.00 am; Thursday, 8.00 am–12.00 am; Friday, 8.00 am–12.00 am; Saturday, 8.00 am–12.00 am; Sunday, 8.00 am–12.00 am}"
3,110 Degree Cafe,"Gg. Apokat, Kledokan, Caturtunggal, Kec. Sleman, Yogyakarta, Daerah Istimewa Yogyakarta 55281",85229969755,4.9,174,Coffee shop,Open ⋅ Closes 2 AM
4,28 Coffee Jakal Km 11,"Pedak, Sinduharjo, Kec. Ngaglik, Kabupaten Sleman, Daerah Istimewa Yogyakarta 55581, Indonesia",#ERROR!,4.7,518,Coffee shop,Open 24 hours
5,7 Clover Coffee,"Jl. Sukoharjo no 132 G, RT.06/RW.30, Gejayan, Condongcatur, Kec. Depok, Kabupaten Sleman, Daerah Istimewa Yogyakarta 55283",0882-0030-71822,4.8,189,Cafe,"{Monday, 7.00 am–10.00 pm; Tuesday, 7.00 am–10.00 pm; Wednesday, 7.00 am–10.00 pm; Thursday, 7.00 am–10.00 pm; Friday, 7.00 am–10.00 pm; Saturday, 7.00 am–10.00 pm; Sunday, 7.00 am–10.00 pm}"
6,Ad Meliora Coffee and eatery,"8C66+P42, Jl. Nglanjaran, Candirejo, Sardonoharjo, Ngaglik, Sleman Regency, Special Region of Yogyakarta, Indonesia",#ERROR!,4.8,30,Coffee shop,Open 24 hours
7,Agoge Cafe,"Jl. Bima Jl. Panggungsari No.164f, Wonorejo, Sariharjo, Kec. Ngaglik, Kabupaten Sleman, Daerah Istimewa Yogyakarta 55581",,4.6,414,Cafe,"{Monday, 7.00 am–11.00 pm; Tuesday, 7.00 am–11.00 pm; Wednesday, 7.00 am–11.00 pm; Thursday, 7.00 am–11.00 pm; Friday, 7.00 am–11.00 am; Saturday, 7.00 am–11.00 am; Sunday, 7.00 am–11.00 pm}"
8,Allerta Coffee,"Kaliwanglu, Kalidadap, Harjobinangun, Kec. Pakem, Kabupaten Sleman, Daerah Istimewa Yogyakarta 55582, Indonesia",#ERROR!,4.8,21,Coffee shop,Closed ⋅ Opens 3 PM
9,ALOHA JOGJA,"RT.01, Karang Bajang, Tlogoadi, Mlati, Sleman Regency, Special Region of Yogyakarta 55286",81326054079,4.6,307,Coffee shop,Open ⋅ Closes 11 PM
10,"Altilis Coffee, Smoothies, and Eatery","Jalan Baru Mulungan No.88, RW No.RT.04, Gilingan, Sendangadi, Kec. Mlati, Kabupaten Sleman, Daerah Istimewa Yogyakarta 55285",82227282024,4.9,118,Coffee shop,Open ⋅ Closes 11 PM
11,Aming Coffee,"Jl. Gito Gati Jl. Grojogan No.Km. 1, Penggung, Tridadi, Kec. Sleman, Kabupaten Sleman, Daerah Istimewa Yogyakarta 55511",,4.6,421,Coffee shop,Open ⋅ Closes 10 PM
12,Anomie Coffee,"Jalan Gandok Baru Condongcatur, Manggung, Caturtunggal, Kec. Depok, Kabupaten Sleman, Daerah Istimewa Yogyakarta 55281",,4.7,187,Coffee shop,Open ⋅ Closes 10 PM
13,Anteiku Coffee,"Jalan Kaliurang Timur 27, Bakungan, Wedomartani, Ngemplak, Sleman, Daerah, Istimewa Yogyakarta, Kabupaten Sleman, Daerah Istimewa Yogyakarta 55584, Indonesia",,4.9,27,Coffee shop,
14,ARAH Coffee Pandawa,"Kaliurang St No.27, Karang Wuni, Caturtunggal, Depok, Sleman Regency, Special Region of Yogyakarta 55284",81128512545,4.5,"1,110",Cafe,Open 24 Hours
15,Astajava Coffee and Roastery,"Tambak Rejo, Sariharjo, Dusun, Tambak Rejo, wonokerso, Kec. Ngaglik, Kabupaten Sleman, Daerah Istimewa Yogyakarta 55581",82134407349,4.7,385,Coffee shop,Open ⋅ Closes 11:30 PM
16,ATHENA Coffee Social Space,"Jl. Kakatua No.5 Blok. K, RT.05/RW.07, Pondok, Condongcatur, Kec. Depok, Kabupaten Sleman, Daerah Istimewa Yogyakarta 55281",81237791939,5,48,Coffee shop,Open ⋅ Closes 2 AM
17,Awan Mbengi Coffee & Sisha Stall,"Kaliurang St No.KM 9, Gondangan, Sardonoharjo, Ngaglik, Sleman Regency, Special Region of Yogyakarta 55581, Indonesia",#ERROR!,4.5,1423,Coffee shop,Open ⋅ Closes 12 AM
18,Awor Coffee Kaliurang,"Jl. Besi Jaya, Besi, Sukoharjo, Kec. Ngaglik, Kabupaten Sleman, Daerah Istimewa Yogyakarta 55581",82119318601,4.7,265,Cafe,"{Monday, 8.00 am–11.00 pm; Tuesday, 8.00 am–11.00 pm; Wednesday, 8.00 am–11.00 pm; Thursday, 8.00 am–11.00 pm; Friday, 8.00 am–11.00 am; Saturday, 8.00 am–11.00 am; Sunday, 8.00 am–11.00 pm}"
19,Awor Yard & Coffee,"Jl. Palagan Tentara Pelajar P6 No.km 7, Mudal, Sariharjo, Kec. Ngaglik, Kabupaten Sleman, Daerah Istimewa Yogyakarta 55581",81227860397,4.6,418,Cafe,Open 24 Hours
20,"Ayam Panggang ""Mbah Mo"" Kaliurang","Kaliurang St No.km 16,5, Kledokan, Umbulmartani, Ngemplak, Sleman Regency, Special Region of Yogyakarta 55582, Indonesia",#ERROR!,4.7,2942,Coffee shop,Open ⋅ Closes 8 PM
21,Ayem-Ayem Coffee,"Jl. Jugang Pangukan No.13B, Panglikan, Tridadi, Kec. Sleman, Kabupaten Sleman, Daerah Istimewa Yogyakarta 55286",82328028508,4.5,463,Coffee shop,Open ⋅ Closes 11 PM
22,Ayom Cafe,"Jl. Dalgino, Area Sawah, Banyuraden, Kec. Gamping, Kabupaten Sleman, Daerah Istimewa Yogyakarta 55293",8112957095,4.7,"3,716",Cafe,"{Monday, 10.00 am–10.00 pm; Tuesday, 10.00 am–10.00 pm; Wednesday, 10.00 am–10.00 pm; Thursday, 10.00 am–10.00 pm; Friday, 10.00 am–10.00 pm; Saturday, 9.00 am–10.00 pm; Sunday, 9.00 am–10.00 pm}"
23,Balcos Compound,"6CF2+CRF, Jl. Nologaten, Nologaten, Caturtunggal, Kec. Depok, Kabupaten Sleman, Daerah Istimewa Yogyakarta 55281",82117549291,4.5,"1,247",Cafe,"{Monday, 9.00 am–12.00 am; Tuesday, 9.00 am–12.00 am; Wednesday, 9.00 am–12.00 am; Thursday, 9.00 am–12.00 am; Friday, 9.00 am–12.00 am; Saturday, 9.00 am–12.00 am; Sunday, 9.00 am–12.00 am}"
24,"Bangi Kopi, Sleman City Hall, Yogyakarta","79H6+PX5, Jl. Gito Gati, Denggung, Tridadi, Kec. Sleman, Kabupaten Sleman, Daerah Istimewa Yogyakarta 55511",2742885708,4.2,233,Coffee shop,Open ⋅ Closes 10 PM
25,BEBASS - Coffee & Story,"Bedingin, Sumberadi, Mlati, Sleman Regency, Yogyakarta, Daerah Istimewa Yogyakarta 55288",89619178575,4.9,48,Coffee shop,Closed ⋅ Opens 3 PM
26,Bestfrengs Yogyakarta,"Jl. Pandega Sakti No.3, Manggung, Caturtunggal, Kec. Depok, Kabupaten Sleman, Daerah Istimewa Yogyakarta 55571",82244029460,5,13,Cafe,"{Monday, 2.00–10.00 pm; Tuesday, 2.00–10.00 pm; Wednesday, 2.00–10.00 pm; Thursday, 2.00–10.00 pm; Friday, 2.00–10.00 pm; Saturday, 2.00–10.00 pm; Sunday, 2.00–10.00 pm}"
27,Beyek Kopi Manual Brew,"Daerah Istimewa, Sanggrahan, Tlogoadi, Kec. Mlati, Kabupaten Sleman, Daerah Istimewa Yogyakarta 55286",85647346778,4.9,15,Coffee shop,Closed ⋅ Opens 7 PM
28,Bintang Coffee View Merapi,"Jl. Meces, Legolan, Umbulmartani, Ngemplak, Sleman Regency, Special Region of Yogyakarta 55583, Indonesia",#ERROR!,4.6,50,Coffee shop,Open ⋅ Closes 11 PM
29,Bits of Bites,"100 M Utara PonPes, Jl. Pandanaran Jl. Kaliurang No.3, Turen, Sardonoharjo, Kec. Ngaglik, Kabupaten Sleman, Daerah Istimewa Yogyakarta 55581, Indonesia",#ERROR!,5,36,Coffee shop,Open ⋅ Closes 7 PM
30,Blok House,"69GG+45X GIK UGM, Jl. Persatuan, Sendowo, Sinduadi, Kec. Depok, Kabupaten Sleman, Daerah Istimewa Yogyakarta 55223",0895-8066-85207,4.9,77,Cafe,"{Monday, 7.00 am–10.00 pm; Tuesday, 7.00 am–10.00 pm; Wednesday, 7.00 am–10.00 pm; Thursday, 7.00 am–10.00 pm; Friday, 7.00 am–10.00 pm; Saturday, 7.00 am–10.00 pm; Sunday, 7.00 am–10.00 pm}"
31,Blue Heron,"Jl. Asem Gede No.23, Sanggrahan, Condongcatur, Kec. Depok, Kabupaten Sleman, Daerah Istimewa Yogyakarta 55281",82228888220,4.8,525,Cafe,"{Monday, 11.00 am–4.00 pm; Tuesday, 6.30 am–10.00 pm; Wednesday, 6.30 am–9.00 pm; Thursday, 6.30 am–10.00 pm; Friday, 6.30 am–9.00 pm; Saturday, 6.30 am–10.00 pm; Sunday, 6.30 am–10.00 pm}"
32,Bootchin Coffee @T3lu Jakal Yogyakarta,"Gg Anggrek No 36 Gondangan RT/RW 05/45, Sardonoharjo, Kec. Ngaglik, Kabupaten Sleman, Daerah Istimewa Yogyakarta 55581, Indonesia",#ERROR!,5,7,Coffee shop,Open ⋅ Closes 9 pm
33,Brainly Coffee & Store,"Ruko permai, Jl. Pandega Marta III Jl. Ring Road Utara No.3, Purwosari, Sinduadi, Kec. Mlati, Kabupaten Sleman, Daerah Istimewa Yogyakarta 55284",,4.9,43,Coffee shop,Open ⋅ Closes 11:30 PM
34,Bestie Kopi Jogja,"Jl. Palagan Tentara Pelajar No.126, Jongkang, Sariharjo, Kec. Ngaglik, Kabupaten Sleman, Daerah Istimewa Yogyakarta 55581",8112909975,4.8,54,Cafe,"{Monday, 7.00 am–9.00 pm; Tuesday, 7.00 am–9.00 pm; Wednesday, 7.00 am–9.00 pm; Thursday, 7.00 am–9.00 pm; Friday, 7.00 am–10.00 pm; Saturday, 7.00 am–10.00 pm; Sunday, 7.00 am–9.00 pm}"
35,Caboot 1911 Coffee House,"79CG+6M6, Jl. Shinta, Karang Moko, Sariharjo, Kec. Ngaglik, Kabupaten Sleman, Daerah Istimewa Yogyakarta 55581",87886674646,4.7,281,Coffee shop,Open ⋅ Closes 10 PM
36,Cafe Bico,"69M7+F9W, Kutu Dukuh, Sinduadi, Kec. Mlati, Kabupaten Sleman, Daerah Istimewa Yogyakarta 55284",,4.8,140,Cafe,"{Monday, 8.00 am–7.00 pm; Tuesday, 8.00 am–7.00 pm; Wednesday, 8.00 am–7.00 pm; Thursday, 8.00 am–7.00 pm; Friday, 8.00 am–7.00 pm; Saturday, 8.00 am–7.00 pm; Sunday, Closed}"
37,Canie Coffee & Space,"Jl. Pandega Marta No.99, RT.03 RW01/RW.Kalurahan, Manggung, Caturtunggal, Kec. Depok, Kabupaten Sleman, Daerah Istimewa Yogyakarta 55281",81138239900,4.5,303,Cafe,"{Monday, 9.00 am–12.30 am; Tuesday, 9.00 am–12.30 am; Wednesday, 9.00 am–12.30 am; Thursday, 9.00 am–12.30 am; Friday, 9.00 am–12.30 am; Saturday, 9.00 am–12.30 am; Sunday, 9.00 am–12.30 am}"
38,CAPSLOCK COFFEE,"Blk. A No.a15, Pogung Kidul, Sinduadi, Kec. Mlati, Kabupaten Sleman, Daerah Istimewa Yogyakarta 55284",8982252555,4.5,343,Cafe,"{Monday, 9.00 am–11.30 pm; Tuesday, 9.00 am–11.30 pm; Wednesday, 9.00 am–11.30 pm; Thursday, 9.00 am–11.30 pm; Friday, 9.00 am–11.30 pm; Saturday, 9.00 am–11.30 pm; Sunday, 9.00 am–11.30 pm}"
39,Carani Coffee & Eatery,"Jl. Wijaya Kusuma, Dero, Condongcatur, Kec. Depok, Kabupaten Sleman, Daerah Istimewa Yogyakarta 55281",,4.7,178,Coffee shop,Closed ⋅ Opens 4 PM
40,Carney Co,"Jl. Garuni II, Kledokan, Caturtunggal, Kec. Depok, Kabupaten Sleman, Daerah Istimewa Yogyakarta 55281",,4.5,"2,333",,"{Monday, 10.00 am–1.00 am; Tuesday, 10.00 am–1.00 am; Wednesday, 10.00 am–1.00 am; Thursday, 10.00 am–1.00 am; Friday, 10.00 am–1.00 am; Saturday, 10.00 am–1.00 am; Sunday, 10.00 am–1.00 am}"
41,Chandari Heaven,"Sumberwatu, Sambirejo, Prambanan, Sleman Regency, Special Region of Yogyakarta 55572",(0274)2855118,4.7,"2,943",Cafe,"{Monday, 9.00 am–8.00 pm; Tuesday, 9.00 am–8.00 pm; Wednesday, 9.00 am–8.00 pm; Thursday, 9.00 am–8.00 pm; Friday, 9.00 am–8.00 pm; Saturday, 9.00 am–8.00 pm; Sunday, 9.00 am–8.00 pm}"
42,Coconut Coffee & Eatery Palagan,"Jl. Pandhawa, Tegal Rejo, Sariharjo, Kec. Ngaglik, Kabupaten Sleman, Daerah Istimewa Yogyakarta 55581",81770455890,4.8,924,Cafe,"{Monday, 8.00 am–10.00 pm; Tuesday, 8.00 am–10.00 pm; Wednesday, 8.00 am–10.00 pm; Thursday, 8.00 am–10.00 pm; Friday, 8.00 am–10.00 pm; Saturday, 8.00 am–10.00 pm; Sunday, 8.00 am–10.00 pm}"
43,Coffee Deeen,"Gg. Mangga III No.7j, Ngentak, Caturtunggal, Kec. Depok, Kabupaten Sleman, Daerah Istimewa Yogyakarta 55281",,4.8,46,Coffee shop,Open ⋅ Closes 10 PM
44,Coffeebara,"Jl. Randugowang Utama, Tegal Weru, Sariharjo, Ngaglik, Sleman Regency, Special Region of Yogyakarta 55264, Indonesia",#ERROR!,4.9,11,Coffee shop,Closed ⋅ Opens 1 pm
45,Coffeetography Jogja,"Jl. Nglanjaran, Turen, Sardonoharjo, Kec. Ngaglik, Kabupaten Sleman, Daerah Istimewa Yogyakarta 55581",82220355504,4.9,66,Coffee shop,Open ⋅ Closes 10 PM
46,Coldhands Coffee Amarta,"Jl. Amarta No.58, Gondangan, Sardonoharjo, Ngaglik, Sleman Regency, Special Region of Yogyakarta 55581, Indonesia",#ERROR!,4.5,23,Coffee shop,Open ⋅ Closes 11 pm
47,Copenhagen - Jakal,"Kaliurang St No.KM.9, Gondangan, Sardonoharjo, Ngaglik, Sleman Regency, Special Region of Yogyakarta 55581",81127009989,4.9,427,Cafe,"{Monday, 7.00 am–2.00 am; Tuesday, 7.00 am–2.00 am; Wednesday, 7.00 am–2.00 am; Thursday, 7.00 am–2.00 am; Friday, 7.00 am–2.00 am; Saturday, 7.00 am–2.00 am; Sunday, 7.00 am–2.00 am}"
48,Cornel Toraja Coffee,"Jl. Cemp. No.146, Dero, Condongcatur, Kec. Depok, Kabupaten Sleman, Daerah Istimewa Yogyakarta 55281",81222662259,4.8,647,Coffee shop,Open ⋅ Closes 10 PM
49,COSAN - Demangan,"Jl. Demangan Baru No.29, Mrican, Caturtunggal, Kec. Depok, Kabupaten Sleman, Daerah Istimewa Yogyakarta 55281",85959145708,4.5,856,Cafe,"{Monday, 7.00 am–12.00 am; Tuesday, 7.00 am–12.00 am; Wednesday, 7.00 am–12.00 am; Thursday, 7.00 am–12.00 am; Friday, 7.00 am–12.00 am; Saturday, 7.00 am–12.00 am; Sunday, 7.00 am–12.00 am}"
50,COSAN - Seturan,"Jl. Seturan Raya No.6, Kledokan, Caturtunggal, Kec. Depok, Kabupaten Sleman, Daerah Istimewa Yogyakarta 55281",,4.3,816,Cafe,"{Monday, 8.00 am–12.00 am; Tuesday, 8.00 am–12.00 am; Wednesday, 8.00 am–12.00 am; Thursday, 8.00 am–12.00 am; Friday, 8.00 am–12.00 am; Saturday, 8.00 am–12.00 am; Sunday, 8.00 am–12.00 am}"
51,Couvee - Jalan Kaliurang,"KM 5, Kaliurang St Jl. Pandega Karya No.18, RW.6, Manggung, Caturtunggal, Depok, Sleman Regency, Special Region of Yogyakarta 55281",,4.6,"2,294",Cafe,"{Monday, 8.00 am–11.00 pm; Tuesday, 8.00 am–11.00 pm; Wednesday, 8.00 am–11.00 pm; Thursday, 8.00 am–11.00 pm; Friday, 8.00 am–11.00 pm; Saturday, 8.00 am–11.00 pm; Sunday, 8.00 am–11.00 pm}"
52,Couvee - Palagan (Take Away Store),"Jl. Kranji Jl. Krikilan, RT.06/RW.22, Randuguang, Sariharjo, Kec. Ngaglik, Kabupaten Sleman, Daerah Istimewa Yogyakarta 55581",85742288443,4.7,122,Cafe,"{Monday, 9.00 am–9.00 pm; Tuesday, 9.00 am–9.00 pm; Wednesday, 9.00 am–9.00 pm; Thursday, 9.00 am–9.00 pm; Friday, 9.00 am–9.00 pm; Saturday, 9.00 am–9.00 pm; Sunday, 9.00 am–9.00 pm}"
53,Couvee - Plaza Ambarrukmo,"Plaza Ambarrukmo, Jl. Laksda Adisucipto, Ambarukmo, Caturtunggal, Kec. Depok, Kabupaten Sleman, Daerah Istimewa Yogyakarta 55281",8112950195,4.4,65,Cafe,"{Monday, 10.00 am–10.00 pm; Tuesday, 10.00 am–10.00 pm; Wednesday, 10.00 am–10.00 pm; Thursday, 10.00 am–10.00 pm; Friday, 10.00 am–10.00 pm; Saturday, 10.00 am–10.00 pm; Sunday, 10.00 am–10.00 pm}"
54,Couvee - Seturan,"Jl. Seturan Raya No.88, Kledokan, Caturtunggal, Kec. Depok, Kabupaten Sleman, Daerah Istimewa Yogyakarta 55281",81215952236,4.6,"2,292",Cafe,"{Monday, 8.00 am–12.00 am; Tuesday, 8.00 am–12.00 am; Wednesday, 8.00 am–12.00 am; Thursday, 8.00 am–12.00 am; Friday, 8.00 am–12.00 am; Saturday, 8.00 am–12.00 am; Sunday, 8.00 am–12.00 am}"
55,Cuena Coffee House,"Perumahan Darussalam III No.C14, Jetis, Wedomartani, Ngemplak, Sleman Regency, Special Region of Yogyakarta 55584, Indonesia",#ERROR!,4.9,240,Coffee shop,Open ⋅ Closes 9:30 PM
56,CultureHead • Signature,"Kaliurang St No.KM.14, Tj. Manding, Umbulmartani, Ngemplak, Sleman Regency, Special Region of Yogyakarta 55584, Indonesia",#ERROR!,4.5,251,Coffee shop,Open ⋅ Closes 12 AM
57,Cupable Coffee,"Kaliurang St No.km.13,5, Besi, Sukoharjo, Ngaglik, Sleman Regency, Special Region of Yogyakarta 55581, Indonesia",#ERROR!,4.8,153,Coffee shop,Open ⋅ Closes 9 PM
58,CW Coffee & Eatery Seturan Jogja,"6CG5+RMG, Jl. Seturan Raya, Kledokan, Caturtunggal, Kec. Depok, Kabupaten Sleman, Daerah Istimewa Yogyakarta 55281",,4,383,Cafe,Open 24 Hours
59,CXMM Coffee By Mountain Merch,"Jl. Umbul Permai No.100, Wonorejo, Sinduharjo, Ngaglik, Sleman Regency, Special Region of Yogyakarta 55581, Indonesia",#ERROR!,4.7,366,Coffee shop,Closed ⋅ Opens 3:30 PM
60,Daily Life Pleasure (Coffeehouse),"Jl. Dusun Pajangan No.144, Berkisan, Pandowoharjo, Kec. Sleman, Kabupaten Sleman, Daerah Istimewa Yogyakarta 55281",81352900181,4.9,58,Coffee shop,Open ⋅ Closes 12 AM
61,DAILYFAVOR Coffee,"Jl. Watugede No.69, Wonorejo, Sariharjo, Kec. Ngaglik, Kabupaten Sleman, Daerah Istimewa Yogyakarta 55581",81229892077,4.6,144,Coffee shop,Open ⋅ Closes 11 PM
62,Dawuhan Roastery (Kopi Arabika Sindoro),"Jl. Letnan Sumanto.2A, Srimulyo, Triharjo, Kec. Sleman, Kabupaten, Jl. Letnan Sumanto, RT.002/RW.003, Srimulyo I, Triharjo, Kabupaten Sleman, Daerah Istimewa Yogyakarta 55514",89603031680,4.9,14,Coffee shop,Open ⋅ Closes 10 PM
63,Demakijo’s | Coffee & Eatery,"Cokrowijayan, Banyuraden, Gamping, Sleman Regency, Special Region of Yogyakarta 55293",81977772025,5,613,Cafe,"{Monday, 10.00 am–12.00 am; Tuesday, 10.00 am–12.00 am; Wednesday, 10.00 am–12.00 am; Thursday, 10.00 am–12.00 am; Friday, 10.00 am–12.00 am; Saturday, 10.00 am–12.00 am; Sunday, 10.00 am–12.00 am}"
64,DIGIZ COFFEE & EATERY,"Dusun Jayan, Area Sawah, Sukoharjo, Kec. Ngaglik, Kabupaten Sleman, Daerah Istimewa Yogyakarta 55581, Indonesia",#ERROR!,4.9,141,Coffee shop,Closed ⋅ Opens 2 PM
65,DIJOGJA COFFEE ROASTERY & PASTA,"Jl. Weling Raya, karanggayam, Caturtunggal, Kec. Depok, Kabupaten Sleman, Daerah Istimewa Yogyakarta 55281",8563137007,4.8,168,Coffee shop,Open ⋅ Closes 10:30 PM
66,Dingo Coffee - UII,"Jalan Kaliurang Km 14.5 Lodadi no.13, Lodadi, Umbulmartani, Kec. Ngemplak, Kabupaten Sleman, Daerah Istimewa Yogyakarta 55584, Indonesia",#ERROR!,4.8,237,Coffee shop,Open ⋅ Closes 10:30 PM
67,Dira Coffee,"Jl. Sembada, RW.nomer 006, Ngentak, Sinduharjo, Ngaglik, Sleman Regency, Special Region of Yogyakarta 55581, Indonesia",,4.9,8,Coffee shop,Open ⋅ Closes 10 PM
68,DJA VA CAFE,"Rejosari, Sardonoharjo, Ngaglik, Sleman Regency, Special Region of Yogyakarta 55581, Indonesia",#ERROR!,5,1,Coffee shop,Open ⋅ Closes 8:30 PM
69,DJIWANA Cafe & Eatery,"Jl. Jatirejo, RT.01/RW.21, Jongke Tengah, Sendangadi, Kec. Mlati, Kabupaten Sleman, Daerah Istimewa Yogyakarta 55285",(0274)5051212,4.5,269,Cafe,"{Monday, 11.00 am–10.00 pm; Tuesday, 11.00 am–10.00 pm; Wednesday, 11.00 am–10.00 pm; Thursday, 11.00 am–10.00 pm; Friday, 11.00 am–10.00 pm; Saturday, 11.00 am–10.00 pm; Sunday, 11.00 am–10.00 pm}"
70,d'Kappu Soemantri Coffee & Brunch,"Jl. Kapulogo Nologaten No.240, Nologaten, Caturtunggal, Kec. Depok, Kabupaten Sleman, Daerah Istimewa Yogyakarta 63411",0882-0060-82070,4.9,77,Cafe,"{Monday, 9.00 am–10.00 pm; Tuesday, 9.00 am–10.00 pm; Wednesday, 9.00 am–10.00 pm; Thursday, 9.00 am–10.00 pm; Friday, 9.00 am–10.00 pm; Saturday, 9.00 am–10.00 pm; Sunday, 9.00 am–10.00 pm}"
71,Doa Ibu Land,"Jl. Turgo Barisan, Kalidadap, Harjobinangun, Pakem, Sleman Regency, Special Region of Yogyakarta 55582, Indonesia",#ERROR!,4.9,65,Coffee shop,
72,Dongeng Kopi,"Jalan Dalangan - Kalimati, Kalimati, Tirtomartani, Kec. Kalasan, Kabupaten Sleman, Daerah Istimewa Yogyakarta 55571",87719999267,4.6,581,Coffee shop,Open ⋅ Closes 8 PM
73,Eastpresso Coffee and Space,"Jenengan, Maguwoharjo, Depok, Sleman Regency, Special Region of Yogyakarta 55584",82147284411,4.7,127,Coffee shop,Closed ⋅ Opens 3 PM
74,Eazy Breezy,"7C2J+XWQ, Gedongan Lor, Wedomartani, Kec. Ngemplak, Kabupaten Sleman, Daerah Istimewa Yogyakarta 55584",81329086565,4.4,416,Cafe,"{Monday, 9.00 am–1.00 am; Tuesday, 9.00 am–1.00 am; Wednesday, 9.00 am–1.00 am; Thursday, 9.00 am–1.00 am; Friday, 9.00 am–1.00 am; Saturday, 9.00 am–1.00 am; Sunday, 9.00 am–1.00 am}"
75,Edirne Coffee & Space,"Jl. Bima, Nglaban, Sinduharjo, Ngaglik, Sleman Regency, Special Region of Yogyakarta 55581, Indonesia",#ERROR!,4.8,280,Coffee shop,Open ⋅ Closes 12 AM
76,Ekologi Desk & Coffee,"69PQ+6G2, Jalan Gambir 4, Karang Gayam CT VIII No.139, Karang Gayam, Caturtunggal, Kec. Depok, Kabupaten Sleman, Daerah Istimewa Yogyakarta 55281",(0274)514295,4.5,"2,851",,"{Monday, 9.00 am–11.00 pm; Tuesday, 9.00 am–11.00 pm; Wednesday, 9.00 am–11.00 pm; Thursday, 9.00 am–11.00 pm; Friday, 9.00 am–11.00 pm; Saturday, 9.00 am–11.00 pm; Sunday, 9.00 am–11.00 pm}"
77,El Coffee & Roastery,"Ngangkrik, Triharjo, Sleman, Sleman Regency, Special Region of Yogyakarta 55514",85385581200,4.4,418,Coffee shop,Closed ⋅ Opens 4 PM
78,elo coffe and eatry,"893X+59C, Jl. Dusun Mrisen, Pencar Sari, Sardonoharjo, Ngaglik, Sleman Regency, Special Region of Yogyakarta 55581, Indonesia",,5,1,Coffee shop,Open 24 hours
79,Enggar Coffeshop,"Jl. Bonjotan No.1, Candirejo, Sardonoharjo, Ngaglik, Sleman Regency, Special Region of Yogyakarta 55581, Indonesia",,,,Coffee shop,
80,Enyui Coffee,"Jl. Palagan Tentara Pelajar No.KM. 14, Kasenan, Donoharjo, Ngaglik, Sleman Regency, Special Region of Yogyakarta 55581, Indonesia",#ERROR!,4.7,263,Coffee shop,Open ⋅ Closes 10 PM
81,Epic Coffee & Epilog Furniture,"Jl. Palagan Tentara Pelajar No.29, Mudal, Sariharjo, Kec. Ngaglik, Kabupaten Sleman, Daerah Istimewa Yogyakarta 55581",2744530704,4.5,"4,245",Coffee shop,Open ⋅ Closes 11 PM
82,ESCO RESTAURANT & NO.27 COFFEE,"Jl. Pringgodani Jl. Demangan Baru No.14, Mrican, Caturtunggal, Kec. Depok, Kabupaten Sleman, Daerah Istimewa Yogyakarta 55281",,4.6,"1,537",Cafe,"{Monday, 8.00 am–11.30 pm; Tuesday, 8.00 am–11.30 pm; Wednesday, 8.00 am–11.30 pm; Thursday, 8.00 am–11.30 pm; Friday, 8.00 am–11.30 pm; Saturday, 8.00 am–11.30 pm; Sunday, 8.00 am–11.30 pm}"
83,Escobar Coffee House,"Jl. Agrowisata No.km,3, Kawedan, Bangun Kerto, Turi, Sleman Regency, Special Region of Yogyakarta 55551, Indonesia",#ERROR!,4.9,9,Coffee shop,Closed ⋅ Opens 6:15 PM
84,ESKALA Eatery Bar & Coffee,"Jl. Palagan Tentara Pelajar, Tegal Rejo, Sariharjo, Kec. Ngaglik, Kabupaten Sleman, Daerah Istimewa Yogyakarta 55581",274886324,4.5,"3,415",Coffee shop,Closed ⋅ Opens 3 PM
85,Estuary Café,"Gang Code 3, Karangjati Wetan, No.170 C, Monjali St, RT.06/RW.45, Gemawang, Sinduadi, Mlati, Sleman Regency, Special Region of Yogyakarta 55283",(0274)5014118,4.6,"3,504",Cafe,"{Monday, 9.00 am–11.00 pm; Tuesday, 9.00 am–11.00 pm; Wednesday, 9.00 am–11.00 pm; Thursday, 9.00 am–11.00 pm; Friday, 9.00 am–11.00 pm; Saturday, 9.00 am–11.00 pm; Sunday, 9.00 am–11.00 pm}"
86,ETECE Coffee Roastery,"Jalan Tata Bumi (Perumahan, Jl. Gading Sari II No.2, Banyuraden, Kec. Gamping, Kabupaten Sleman, Daerah Istimewa Yogyakarta 55293",88221700000,4.9,102,Cafe,"{Monday, 8.00 am–12.00 am; Tuesday, 8.00 am–12.00 am; Wednesday, 8.00 am–12.00 am; Thursday, 8.00 am–12.00 am; Friday, 8.00 am–12.00 am; Saturday, 8.00 am–12.00 am; Sunday, 8.00 am–12.00 am}"
87,Eternity Coffee,"Jalan Kaliurang KM 12 Ngaglik, Candi Karang, Sardonoharjo, Kec. Depok, Kabupaten Sleman, Daerah Istimewa Yogyakarta 55281, Indonesia",#ERROR!,4.8,1680,Coffee shop,Open 24 hours
88,Ethikopia CoffeeBay,"Karang Geneng, Sendangadi, Mlati, Sleman Regency, Special Region of Yogyakarta 55285",0895-4219-06651,4.7,"2,101",Coffee shop,Open 24 hours
89,Ever Coffee Yogyakarta,"Jl. Rogoyudan 1 No.1, Rogoyudan, Sinduadi, Kec. Mlati, Kabupaten Sleman, Daerah Istimewa Yogyakarta 55284",0895-6104-59703,4.6,464,Cafe,"{Monday, 8.00 am–12.00 am; Tuesday, 8.00 am–12.00 am; Wednesday, 8.00 am–12.00 am; Thursday, 8.00 am–12.00 am; Friday, 8.00 am–12.00 am; Saturday, 8.00 am–12.00 am; Sunday, 8.00 am–12.00 am}"
90,Fifth Note,"Jl. Damai No.5A, Karang Moko, Sariharjo, Kec. Ngaglik, Kabupaten Sleman, Daerah Istimewa Yogyakarta 55581",,4.8,97,Cafe,"{Monday, 8.00 am–12.00 am; Tuesday, 8.00 am–12.00 am; Wednesday, 8.00 am–12.00 am; Thursday, 8.00 am–12.00 am; Friday, 8.00 am–12.00 am; Saturday, 8.00 am–12.00 am; Sunday, 8.00 am–12.00 am}"
91,Filosofi Kopi Jogja,"Jl. Pandhawa No.001/17, Tegal Rejo, Sariharjo, Kec. Ngaglik, Kabupaten Sleman, Daerah Istimewa Yogyakarta 55581",8170737027,4.5,11297,Coffee shop,Open ⋅ Closes 10:30 PM
92,Flavf Coffee Industries,"Niron, Pandowoharjo, Sleman, Sleman Regency, Special Region of Yogyakarta 55512, Indonesia",#ERROR!,,,Coffee shop,
93,Fordo Espresso Bar,"Kaliurang St Jl. Pogung Kidul No.34-33, Pogung Kidul, Sinduadi, Mlati, Sleman Regency, Special Region of Yogyakarta 55284",82325656909,4.6,282,Cafe,Open 24 Hours
94,Fore Coffee - Kaliurang,"Kaliurang St No.KM 5, Karang Wuni, Caturtunggal, Depok, Sleman Regency, Special Region of Yogyakarta 55153",81211118456,4.4,"1,955",,"{Monday, 7.00 am–11.00 pm; Tuesday, 7.00 am–11.00 pm; Wednesday, 7.00 am–11.00 pm; Thursday, 7.00 am–11.00 pm; Friday, 7.00 am–11.00 pm; Saturday, 7.00 am–11.00 pm; Sunday, 7.00 am–11.00 pm}"
95,Freday coffe shop,"Plalangan, Pandowoharjo, Kec. Sleman, Yogyakarta, Daerah Istimewa Yogyakarta 55512, Indonesia",#ERROR!,,,Coffee shop,Closed ⋅ Opens 2 PM
96,Funkydak,"Jl. Garuda No.45, Mrican, Caturtunggal, Kec. Depok, Kabupaten Sleman, Daerah Istimewa Yogyakarta 55281",82124370066,4.1,554,Cafe,"{Monday, 10.00 am–11.00 pm; Tuesday, 10.00 am–11.00 pm; Wednesday, 10.00 am–11.00 pm; Thursday, 10.00 am–11.00 pm; Friday, 10.00 am–11.00 pm; Saturday, 10.00 am–11.00 pm; Sunday, 10.00 am–11.00 pm}"
97,GACA The Publik Haus,"Jl. Gatotkaca No.1G, Santren, Caturtunggal, Kec. Depok, Kabupaten Sleman, Daerah Istimewa Yogyakarta 55281",,4.7,133,Cafe,"{Monday, 10.00 am–11.00 pm; Tuesday, 10.00 am–11.00 pm; Wednesday, 10.00 am–11.00 pm; Thursday, 10.00 am–11.00 pm; Friday, 10.00 am–11.00 pm; Saturday, 10.00 am–11.00 pm; Sunday, 10.00 am–11.00 pm}"
98,GANDHARA COFFE,"Jl. Palagan Tentara Pelajar No.52, Tegal Rejo, Sariharjo, Kec. Ngaglik, Kabupaten Sleman, Daerah Istimewa Yogyakarta 55581",817278146,4.9,31,Coffee shop,Open ⋅ Closes 12 AM
99,Gaskara Coffee & Vibes,"Kutu Wates, Kutu Asem, Sinduadi, Kec. Mlati, Kabupaten Sleman, Daerah Istimewa Yogyakarta 55241",85117300186,5,605,Cafe,"{Monday, 8.00 am–3.00 am; Tuesday, 8.00 am–3.00 am; Wednesday, 8.00 am–3.00 am; Thursday, 8.00 am–3.00 am; Friday, 8.00 am–3.00 am; Saturday, 8.00 am–3.00 am; Sunday, 8.00 am–3.00 am}"
100,Gemati Cafe and Space Yogyakarta,"Jl. Sidomukti, Tiyosan, Condongcatur, Kec. Depok, Kabupaten Sleman, Daerah Istimewa Yogyakarta 55281",,4.6,631,Coffee shop,Open ⋅ Closes 12 AM
101,GOHO Coffee & Eatery,"Jl. Wahid Hasyim No.32, RT.07/RW25/RW.Widoro baru, Ngropoh, Condongcatur, Kec. Depok, Kabupaten Sleman, Daerah Istimewa Yogyakarta 55283",85117786100,4.8,686,Coffee shop,Open ⋅ Closes 12 AM
102,Halte Coffee,"78JX+HVF, Drono, Tridadi, Sleman, Sleman Regency, Special Region of Yogyakarta 55511, Indonesia",,4.5,23,Coffee shop,Closed ⋅ Opens 4 PM
