No,Title,Address,Phone,Rating,Reviews,Type,Hours
129,wahwoo coffee,"Krapyak Kulon, RT.04, Krapyak Kulon, Panggungharjo, Kec. Sewon, Kabupaten Bantul, Daerah Istimewa Yogyakarta 55188",87734233336,4.8,365,Coffee shop,
130,Wande Kopi Roastery,"Komplek Pertokoan Tritunggal, Jl. Tritunggal No. T1, Salakan, Bangunharjo, Kec. Sewon, Kabupaten Bantul, Daerah Istimewa Yogyakarta 55188",87739874757,4.5,663,Coffee shop,
131,Warung Kopi Keno,"494M+26R, Bulu, Trimulyo, Jetis, Bantul Regency, Special Region of Yogyakarta 55781, Indonesia",#ERROR!,5,7,Coffee shop,Closed ⋅ Opens 4 PM
132,Wedangan Rock Sugar,"Ketonggo Rt02, Ketongo, Wonokromo, Kec. Pleret, Kabupaten Bantul, Daerah Istimewa Yogyakarta 55791, Indonesia",,4.7,181,Coffee shop,Open ⋅ Closes 11:59 PM
133,Westpash Coffee,"Sayangan No. 06, Sayangan, Jagalan, Banguntapan, Bantul Regency, Special Region of Yogyakarta 55192",82289811849,4.7,436,Cafe,"{Monday, 8.00 am–11.00 pm; Tuesday, 8.00 am–11.00 pm; Wednesday, 8.00 am–11.00 pm; Thursday, 8.00 am–11.00 pm; Friday, 8.00 am–11.00 pm; Saturday, 8.00 am–11.00 pm; Sunday, 8.00 am–11.00 pm}"
134,White Rose Bakery & Cakes,"Jl. Jend. A. Yani No.24, Nyangkringan, Bantul, Kec. Bantul, Kabupaten Bantul, Daerah Istimewa Yogyakarta 55711",87712379196,4.3,948,Coffee shop,