No,Title,Address,Phone,Rating,Reviews,Type,Hours
209,Relasi Co-Working Space,"69RG+JJ9, Jl. Pogung Baru Blk. E No.34, Pogung Kidul, Sinduadi, Kec. Mlati, Kabupaten Sleman, Daerah Istimewa Yogyakarta 55284",88985188838,4.5,"2,100",Cafe,"{Monday, 9.00 am–12.00 am; Tuesday, 9.00 am–12.00 am; Wednesday, 9.00 am–12.00 am; Thursday, 9.00 am–12.00 am; Friday, 9.00 am–12.00 am; Saturday, 9.00 am–12.00 am; Sunday, 9.00 am–12.00 am}"
210,Resonansi - Coffee Ramen Burger,"Jl. Nglengkong Besi, Nglengkong, Sukoharjo, Ngaglik, Sleman Regency, Special Region of Yogyakarta 55581, Indonesia",#ERROR!,4.7,1034,Coffee shop,Open ⋅ Closes 6 PM
211,Retro cafe,"Jl. Tomat No.48, Palgading, Sinduharjo, Ngaglik, Sleman Regency, Special Region of Yogyakarta 55581, Indonesia",,5,4,Coffee shop,Closed ⋅ Opens 10 AM Wed
212,Roaster Dreams,"Kaliurang St No.km.13,5, Besi, Sukoharjo, Sleman, Yogyakara, Special Region of Yogyakarta 55582, Indonesia",#ERROR!,4.5,13,Coffee shop,Open ⋅ Closes 12 am
213,Ruang Kita Coffee Roastery and Brew,"Jl. Siliwangi No.166, Bedog, Trihanggo, Kec. Gamping, Kabupaten Sleman, Daerah Istimewa Yogyakarta 55293",87885462200,4.4,45,Coffee shop,Open ⋅ Closes 4 PM
214,Rubah Coffee,"Jl. Kayen Raya No.176, Kayen, Condongcatur, Kec. Depok, Kabupaten Sleman, Daerah Istimewa Yogyakarta 55283",81122225171,4.7,91,Cafe,"{Monday, 8.00 am–12.00 am; Tuesday, 8.00 am–12.00 am; Wednesday, 8.00 am–12.00 am; Thursday, 8.00 am–12.00 am; Friday, 8.00 am–3.00 am; Saturday, 8.00 am–3.00 am; Sunday, 8.00 am–3.00 am}"
215,RUMINATE Coffee & Roastery,"Jl. Lempongsari No.111, Sumberan, Sariharjo, Ngaglik, Sleman Regency, Special Region of Yogyakarta 55581, Indonesia",#ERROR!,4.6,1328,Coffee shop,Open ⋅ Closes 12 AM
216,SABAR COFFEE,"793V+3QG, Jl. Yerusalem, Joho, Condongcatur, Kec. Depok, Kabupaten Sleman, Daerah Istimewa Yogyakarta 55281",,4.5,73,Coffee shop,Open ⋅ Closes 10 PM
217,SABIN by Seken Living,"Jl. Ngaglik, Karanglo, Sukoharjo, Kec. Ngaglik, Kabupaten Sleman, Daerah Istimewa Yogyakarta 55581",,4.6,"1,434",Cafe,"{Monday, 10.00 am–9.00 pm; Tuesday, 10.00 am–9.00 pm; Wednesday, 10.00 am–9.00 pm; Thursday, 10.00 am–9.00 pm; Friday, 10.00 am–9.00 pm; Saturday, 10.00 am–9.00 pm; Sunday, 10.00 am–9.00 pm}"
218,Sacaluna Coffee,"Jl. Sidomulyo No.10a, Manukan, Condongcatur, Kec. Depok, Kabupaten Sleman, Daerah Istimewa Yogyakarta 55281",0881-0802-30863,4.8,218,Coffee shop,Open ⋅ Closes 11 PM
219,Samasta coffee,"Pondok, Condong Catur, Depok, Sleman Regency, Special Region of Yogyakarta 55281",81338095667,4.7,349,Coffee shop,Open ⋅ Closes 12 AM
220,Sangrai Kedai Kopi,"Labasan, Pakembinangun, Pakem, Sleman Regency, Special Region of Yogyakarta, Indonesia",#ERROR!,4,10,Coffee shop,Open ⋅ Closes 11 PM
221,Sasmaka Dining & Cafe,"Jl. Raya Ngemplak, Kemasan, Widodomartani, Kec. Ngemplak, Kabupaten Sleman, Daerah Istimewa Yogyakarta 55584",81288858100,4.6,520,Cafe,"{Monday, 11.00 am–8.30 pm; Tuesday, 11.00 am–8.30 pm; Wednesday, 11.00 am–8.30 pm; Thursday, 11.00 am–8.30 pm; Friday, 11.00 am–8.30 pm; Saturday, 11.00 am–8.30 pm; Sunday, 11.00 am–8.30 pm}"
222,Sebelas Coffee - Balcos Compound,"Jl. Kedawung, Nologaten, Caturtunggal, Kec. Depok, Kabupaten Sleman, Daerah Istimewa Yogyakarta 55281",85117439369,4.5,226,Cafe,Open 24 Hours
223,Sebelas Coffee - Gejayan,"Jl. Affandi No.31, Mrican, Caturtunggal, Kec. Depok, Kabupaten Sleman, Daerah Istimewa Yogyakarta 55222",85117439369,4.1,73,Cafe,Open 24 Hours
224,Sebelas Coffee - Monjali,"Monjali St No.111, Gemawang, Sinduadi, Mlati, Sleman Regency, Special Region of Yogyakarta 55288",85117439369,4.5,543,Cafe,Open 24 Hours
225,Sebelas Coffee GO,"Jl. Cemp. No.148, Perumnas Condong Catur, Condongcatur, Kec. Depok, Kabupaten Sleman, Daerah Istimewa Yogyakarta 55281",85117439369,4.2,11,Cafe,Open 24 Hours
226,SEMBALUN COFFEE,"89GR+4J2, Jl. Palagan Tentara Pelajar, Balong, Donoharjo, Kec. Ngaglik, Kabupaten Sleman, Daerah Istimewa Yogyakarta 55581, Indonesia",,5,5,Coffee shop,Open ⋅ Closes 10:30 pm
227,Sembari Coffee,"69QM+8GF, Karang Wuni, Caturtunggal, Depok, Sleman Regency, Special Region of Yogyakarta 55281",,4.6,241,Coffee shop,Open ⋅ Closes 11 PM
228,Sender Coffee // Emma's Personal Space,"Jl. Cenderawasih No.32 B, Demangan, Caturtunggal, Kec. Depok, Kabupaten Sleman, Daerah Istimewa Yogyakarta 55281",8952892212,4.5,207,Cafe,Open 24 Hours
229,SENJA Coffee & Memories,"Jl. Kaliurang No.36 km 4, RW.5, Kocoran, Caturtunggal, Kec. Depok, Kabupaten Sleman, Daerah Istimewa Yogyakarta 55281",8885855855,4.6,"1,207",,"{Monday, 8.00 am–11.00 pm; Tuesday, 8.00 am–11.00 pm; Wednesday, 8.00 am–11.00 pm; Thursday, 8.00 am–11.00 pm; Friday, 8.00 am–11.00 pm; Saturday, 8.00 am–11.00 pm; Sunday, 8.00 am–11.00 pm}"
230,Sepakat Coffee,"Jl. Wahid hasyim No.187A dn, Ngropoh, Condongcatur, Kabupaten Sleman, Daerah Istimewa Yogyakarta 55262",87715307300,4.6,596,Cafe,"{Monday, 7.00 am–11.00 pm; Tuesday, 7.00 am–11.00 pm; Wednesday, 7.00 am–11.00 pm; Thursday, 7.00 am–11.00 pm; Friday, 7.00 am–11.00 pm; Saturday, 7.00 am–11.00 pm; Sunday, 7.00 am–11.00 pm}"
231,Seraya Coffee and Space Jogja,"Jl. Magelang, Rogoyudan, Sinduadi, Kec. Mlati, Kabupaten Sleman, Daerah Istimewa Yogyakarta 55242",87762707569,4.5,92,Cafe,"{Monday, 8.00 am–12.00 am; Tuesday, 8.00 am–12.00 am; Wednesday, 8.00 am–12.00 am; Thursday, 8.00 am–12.00 am; Friday, 8.00 am–12.00 am; Saturday, 8.00 am–12.00 am; Sunday, 8.00 am–12.00 am}"
232,SETTE,"Selatan Astra Honda, Jl. Magelang No.km 7, Mlati Beningan, jati, Kec. Mlati, Kabupaten Sleman, Daerah Istimewa Yogyakarta 55285",8127432354,4.8,165,Coffee shop,Open ⋅ Closes 10 PM
233,Seven Stones Coffee Shop,"Karang Wuni, Caturtunggal, Kec. Depok, Kabupaten Sleman, Daerah Istimewa Yogyakarta 55284",87743605875,4.6,"1,029",,"{Monday, 9.00 am–11.00 pm; Tuesday, 9.00 am–11.00 pm; Wednesday, 9.00 am–11.00 pm; Thursday, 9.00 am–11.00 pm; Friday, 9.00 am–11.00 pm; Saturday, 9.00 am–11.00 pm; Sunday, 9.00 am–11.00 pm}"
234,Sidewalk 27,"Paten, Tridadi, Sleman, Sleman Regency, Special Region of Yogyakarta 55511, Indonesia",#ERROR!,4.9,72,Coffee shop,Closed ⋅ Opens 5 PM
235,Social Smoothies,"Gg. Klp. Gading Jl. Kaliurang, Manggung, Caturtunggal, Kec. Depok, Kabupaten Sleman, Daerah Istimewa Yogyakarta 55281",85190086865,4.9,264,Cafe,"{Monday, 8.00 am–10.00 pm; Tuesday, 8.00 am–10.00 pm; Wednesday, 8.00 am–10.00 pm; Thursday, 8.00 am–10.00 pm; Friday, 8.00 am–10.00 pm; Saturday, 8.00 am–10.00 pm; Sunday, 8.00 am–10.00 pm}"
236,Space Coffee Roastery,"Gg. Loncang No.88, Rogoyudan, Sinduadi, Kec. Mlati, Kabupaten Sleman, Daerah Istimewa Yogyakarta 55284",82288909088,4.7,"1,295",Cafe,"{Monday, 7.00 am–12.00 am; Tuesday, 7.00 am–12.00 am; Wednesday, 7.00 am–12.00 am; Thursday, 7.00 am–12.00 am; Friday, 7.00 am–12.00 am; Saturday, 7.00 am–12.00 am; Sunday, 7.00 am–12.00 am}"
237,Space Roastery | Space Coffee Bar,"Kutu Patran, Sinduadi, Mlati, Sleman Regency, Special Region of Yogyakarta 55284",82288909088,4.6,170,Cafe,"{Monday, 7.00 am–11.00 pm; Tuesday, 7.00 am–11.00 pm; Wednesday, 7.00 am–11.00 pm; Thursday, 7.00 am–11.00 pm; Friday, 7.00 am–11.00 am; Saturday, 7.00 am–11.00 am; Sunday, 7.00 am–11.00 pm}"
238,Spasi Garden & Bistro,"Kaliurang St No.KM16, Area Sawah, Pakembinangun, Pakem, Sleman Regency, Special Region of Yogyakarta 55582, Indonesia",#ERROR!,4.7,15,Coffee shop,Open ⋅ Closes 9 PM
239,STATE Cafe & Brasserie,"Jl. Lempongsari, Jongkang, Sariharjo, Kec. Ngaglik, Kabupaten Sleman, Daerah Istimewa Yogyakarta 55581",85960195261,4.6,699,Cafe,"{Monday, 11.00 am–12.00 am; Tuesday, 11.00 am–12.00 am; Wednesday, 11.00 am–12.00 am; Thursday, 11.00 am–12.00 am; Friday, 11.00 am–12.00 am; Saturday, 11.00 am–12.00 am; Sunday, 11.00 am–12.00 am}"
240,Street Kourt,"7CQ5+6C2, Pedak, Sinduharjo, Ngaglik, Sleman Regency, Special Region of Yogyakarta 55581, Indonesia",#ERROR!,5,56,Coffee shop,
241,SUHKA Coffee Space,"Kaliurang St Gg. Siti Sonya No.KM5, Pogung Kidul, Sinduadi, Mlati, Sleman Regency, Special Region of Yogyakarta 55284",81999554451,4.8,21,Cafe,"{Monday, 7.00 am–11.00 pm; Tuesday, 7.00 am–11.00 pm; Wednesday, 7.00 am–11.00 pm; Thursday, 7.00 am–11.00 pm; Friday, 7.00 am–11.00 pm; Saturday, 7.00 am–11.00 pm; Sunday, 7.00 am–11.00 pm}"
242,Svarga Flora Coffee & Plants,"Jl. Affandi No.26A, Soropadan, Condongcatur, Kec. Depok, Kabupaten Sleman, Daerah Istimewa Yogyakarta 55222",87861810720,4.4,"1,296",,"{Monday, 8.00 am–1.00 am; Tuesday, 8.00 am–1.00 am; Wednesday, 8.00 am–1.00 am; Thursday, 8.00 am–1.00 am; Friday, 8.00 am–1.00 am; Saturday, 8.00 am–1.00 am; Sunday, 8.00 am–1.00 am}"
243,Swallow Coffee Shop,"Jl. Magelang No.km.12, RT.09/RW.20, Krapyak, Triharjo, Sleman, Kota Yogyakarta, Special Region of Yogyakarta 55514, Indonesia",#ERROR!,5,9,Coffee shop,Open ⋅ Closes 9:30 pm
244,TEDUH COFFEE,"Kledokan, Caturtunggal, Depok, Sleman Regency, Special Region of Yogyakarta 55281",82191929202,4.6,968,Coffee shop,Open ⋅ Closes 12 AM
245,Temata Coffee & Patisserie,"Jl. Magelang No.Km. 11, Dukuh, Tridadi, Sleman, Sleman Regency, Special Region of Yogyakarta 55511, Indonesia",#ERROR!,4.9,118,Coffee shop,Open ⋅ Closes 8 PM
246,Tentang Kopi Balegong,"Jl. Pandowoharjo, Sawahan, Pandowoharjo, Sleman, Sleman Regency, Special Region of Yogyakarta 55512, Indonesia",#ERROR!,4.9,38,Coffee shop,Open ⋅ Closes 7 PM
247,Tentrem Bumi Coffee,"Jl. Beringin Raya, Denokan, Maguwoharjo, Kec. Depok, Kabupaten Sleman, Daerah Istimewa Yogyakarta 55282",85282797428,4.5,809,Coffee shop,Open 24 hours
248,Teras Kemala,"Puluhdadi No.394 C, Kledokan, Caturtunggal, Kec. Depok, Kabupaten Sleman, Daerah Istimewa Yogyakarta 55281",87714880999,4.8,53,Cafe,"{Monday, 3.00–11.00 pm; Tuesday, Closed; Wednesday, 3.00–11.00 pm; Thursday, 3.00–11.00 pm; Friday, 3.00–11.00 pm; Saturday, 3.00–11.00 pm; Sunday, 3.00–11.00 pm}"
249,The Bean Garden Coffee and Eatery,"Jl. Ring Road Utara, Pugeran, Maguwoharjo, Kec. Depok, Kabupaten Sleman, Daerah Istimewa Yogyakarta 55281",82116161699,4.5,986,Coffee shop,Open ⋅ Closes 10 PM
250,The Bora Coffee,"Jl. Ir. Bugiakso, Donolayan, Donoharjo, Ngaglik, Sleman Regency, Special Region of Yogyakarta 55581, Indonesia",,,,Coffee shop,
251,The Brewing Room,"Jl. Pandean Sari III No.10, Candok Condongcatur, Kec. Depok, Kabupaten Sleman Daerah Istimewa, Yogyakarta, Daerah Istimewa Yogyakarta 55281",8118778877,4.4,465,Cafe,"{Monday, 10.00 am–12.00 am; Tuesday, 10.00 am–12.00 am; Wednesday, 10.00 am–12.00 am; Thursday, 10.00 am–12.00 am; Friday, 10.00 am–12.00 am; Saturday, 10.00 am–12.00 am; Sunday, 10.00 am–12.00 am}"
252,THE GOOD DRIP - COFFEE TASTING ROOM,"Jl. Palagan Tentara Pelajar No.71, Rejodani 2, Sariharjo, Ngaglik, Sleman Regency, Special Region of Yogyakarta 55581, Indonesia",,5,5,Coffee shop,Closed ⋅ Opens 9 am Fri
253,The Kopi Klub,"Jl. Kaliurang No.km. 15 5, Legolan, Umbulmartani, Kec. Ngemplak, Kabupaten Sleman, Daerah Istimewa Yogyakarta, Indonesia",#ERROR!,,,Coffee shop,Open ⋅ Closes 10 PM
254,The Praja Coffee and Resto,"Kledokan, Umbulmartani, Ngemplak, Sleman Regency, Special Region of Yogyakarta 55584, Indonesia",#ERROR!,4.4,2364,Coffee shop,Open ⋅ Closes 2 AM
255,Thon’s Coffee,"Jl. Seturan Raya, Kledokan, Caturtunggal, Kec. Depok, Kabupaten Sleman, Daerah Istimewa Yogyakarta 55281",81227212891,4.4,700,Coffee shop,Open ⋅ Closes 12 AM
256,THREE COFFEE,"Jl. Griya Taman Asri Jl. Tlacap No.25, Grojogan, Pandowoharjo, Sleman, Sleman Regency, Special Region of Yogyakarta 55512, Indonesia",#ERROR!,,,Coffee shop,Closed ⋅ Opens 12 PM
257,"Tilasawa Coffee Roaster, Manukan","Jl. Kakatua No.100, Manukan, Condongcatur, Kec. Depok, Kabupaten Sleman, Daerah Istimewa Yogyakarta 55281",81228145913,4.6,"1,070",Coffee shop,Open ⋅ Closes 3 AM
258,TINAMPI,"Jl. Kaliwanglu, Kaliwanglu Wetan, Kalidadap, Harjobinangun, Pakem, Sleman Regency, Special Region of Yogyakarta 55582, Indonesia",#ERROR!,4.9,18,Coffee shop,Open ⋅ Closes 4 PM
259,Tjahaja Brewhouse,"Kabupaten, Jl. Amarta No.48, Ngalalangan, Sardonoharjo, Ngaglik, Sleman Regency, Special Region of Yogyakarta 55581, Indonesia",#ERROR!,4.7,138,Coffee shop,Open ⋅ Closes 12 AM
260,Toko Kopi Sedaya,"Jl. Prayan I No.80 C, Kaliwaru, Condongcatur, Kec. Depok, Kabupaten Sleman, Daerah Istimewa Yogyakarta 55281",85179676355,4.9,672,Coffee shop,Open ⋅ Closes 11 PM
261,Toleransi Kopi Palagan,"Jl. Watugede No.50, Wonorejo, Sariharjo, Kec. Ngaglik, Kabupaten Sleman, Daerah Istimewa Yogyakarta 55581",85710106444,4.3,431,Cafe,Open 24 Hours
262,TOMORO COFFE - ATAKRIB,"Jl. Magelang No.5 km 5, Kutu Tegal, Sinduadi, Kec. Mlati, Kabupaten Sleman, Daerah Istimewa Yogyakarta 55284",81217145711,4.8,46,Cafe,"{Monday, 9.00 am–10.00 pm; Tuesday, 9.00 am–10.00 pm; Wednesday, 9.00 am–10.00 pm; Thursday, 9.00 am–10.00 pm; Friday, 9.00 am–10.00 pm; Saturday, 9.00 am–10.00 pm; Sunday, 9.00 am–10.00 pm}"
263,TOMORO COFFEE - Demangan,"Jl. Demangan Baru No.30, RT.008/RW.02, Mrican, Caturtunggal, Kec. Depok, Kabupaten Sleman, Daerah Istimewa Yogyakarta 55281",,4.7,289,Cafe,"{Monday, 8.00 am–10.00 pm; Tuesday, 8.00 am–10.00 pm; Wednesday, 8.00 am–10.00 pm; Thursday, 8.00 am–10.00 pm; Friday, 8.00 am–10.00 pm; Saturday, 8.00 am–10.00 pm; Sunday, 8.00 am–10.00 pm}"
264,TOMORO COFFEE - Godean,"Jl. Godean, Cokro Gedok, Sidoarum, Kec. Gamping, Kabupaten Sleman, Daerah Istimewa Yogyakarta",81227551118,4.3,141,Cafe,"{Monday, 8.00 am–1.00 am; Tuesday, 8.00 am–1.00 am; Wednesday, 8.00 am–1.00 am; Thursday, 8.00 am–1.00 am; Friday, 8.00 am–1.00 am; Saturday, 8.00 am–1.00 am; Sunday, 8.00 am–1.00 am}"
265,TOMORO COFFEE - Jakal UII,"Gg. Werkudoro, Lodadi, Umbulmartani, Kec. Ngemplak, Kabupaten Sleman, Daerah Istimewa Yogyakarta 55584",81119966578,4.5,134,Cafe,"{Monday, 7.00 am–11.00 pm; Tuesday, 7.00 am–11.00 pm; Wednesday, 7.00 am–11.00 pm; Thursday, 7.00 am–11.00 pm; Friday, 7.00 am–11.00 pm; Saturday, 7.00 am–11.00 pm; Sunday, 7.00 am–11.00 pm}"
266,TOMORO COFFEE - Kaliurang,"Kaliurang St No.23-14, Karang Wuni, Caturtunggal, Depok, Sleman Regency, Special Region of Yogyakarta 55284",,4.2,626,Cafe,Open 24 Hours
267,TOMORO COFFEE - Pakuwon Mall Jogja,"Jl. Ring Road Utara, Kaliwaru, Condongcatur, Kec. Depok, Kabupaten Sleman, Daerah Istimewa Yogyakarta 55281",0895-3275-75790,4.5,100,Cafe,"{Monday, 10.00 am–9.50 pm; Tuesday, 10.00 am–9.50 pm; Wednesday, 10.00 am–9.50 pm; Thursday, 10.00 am–9.50 pm; Friday, 10.00 am–9.50 pm; Saturday, 10.00 am–9.50 pm; Sunday, 10.00 am–9.50 pm}"
268,TOMORO COFFEE - Sahid J-Walk,"Jl. Babarsari Hotel Sahid Raya No.2, Janti, Caturtunggal, Kec. Depok, Kabupaten Sleman, Daerah Istimewa Yogyakarta 55281",,4.7,159,Cafe,"{Monday, 7.00 am–10.00 pm; Tuesday, 7.00 am–10.00 pm; Wednesday, 7.00 am–10.00 pm; Thursday, 7.00 am–10.00 pm; Friday, 7.00 am–10.00 pm; Saturday, 7.00 am–10.00 pm; Sunday, 7.00 am–10.00 pm}"
269,TOMORO COFFEE - Seturan,"Jl. Seturan Raya No.C8, Kledokan, Caturtunggal, Kec. Depok, Kabupaten Sleman, Daerah Istimewa Yogyakarta 55281",,4.2,156,Cafe,"{Monday, 7.00 am–11.45 pm; Tuesday, 7.00 am–11.45 pm; Wednesday, 7.00 am–11.45 pm; Thursday, 7.00 am–11.45 pm; Friday, 7.00 am–11.45 pm; Saturday, 7.00 am–11.45 pm; Sunday, 7.00 am–11.45 pm}"
270,TOMORO COFFEE - Sleman City Hall,"Jl. Magelang Jl. Gito Gati No.KM 9, Denggung, Tridadi, Kec. Sleman, Kabupaten Sleman, Daerah Istimewa Yogyakarta 55511",,3.5,71,Cafe,"{Monday, 10.00 am–10.00 pm; Tuesday, 10.00 am–10.00 pm; Wednesday, 10.00 am–10.00 pm; Thursday, 10.00 am–10.00 pm; Friday, 10.00 am–10.00 pm; Saturday, 10.00 am–10.00 pm; Sunday, 10.00 am–10.00 pm}"
271,TOMORO COFFEE PALAGAN,"Jl. Palagan Tentara Pelajar No.101, Jongkang, Sariharjo, Kec. Ngaglik, Kabupaten Sleman, Daerah Istimewa Yogyakarta 55581",,4,120,Cafe,"{Monday, 8.00 am–2.00 am; Tuesday, 8.00 am–2.00 am; Wednesday, 8.00 am–2.00 am; Thursday, 8.00 am–2.00 am; Friday, 8.00 am–2.00 am; Saturday, 8.00 am–2.00 am; Sunday, 8.00 am–2.00 am}"
272,Tong Tji Sleman City Hall,"City Hall, lt.P1, Penggung, Tridadi, Sleman, Sleman Regency, Special Region of Yogyakarta, Indonesia",,4.2,6,Coffee shop,Open ⋅ Closes 10 PM
273,TOTTY Coffee,"Jl. Purbaya, Gabahan, Sumberadi, Kec. Mlati, Kabupaten Sleman, Daerah Istimewa Yogyakarta 55288",8122753638,4.8,245,Coffee shop,Closed ⋅ Opens 1 PM
274,TRILOGI COFFEE,"Jl. Palagan Tentara Pelajar No.8.6 No.KM, Tegal Rejo, Sariharjo, Kec. Ngaglik, Kabupaten Sleman, Daerah Istimewa Yogyakarta 55581",(0274)2833724,4.6,"1,611",Cafe,"{Monday, 8.00 am–11.00 pm; Tuesday, 8.00 am–11.00 pm; Wednesday, 8.00 am–11.00 pm; Thursday, 8.00 am–11.00 pm; Friday, 8.00 am–11.00 pm; Saturday, 8.00 am–11.00 pm; Sunday, 8.00 am–11.00 pm}"
275,Tumbuh Coffee & Workspace,"7CM4+P7C, Gadingan, Sinduharjo, Kec. Ngaglik, Kabupaten Sleman, Daerah Istimewa Yogyakarta 55581",85163611058,4.6,72,Coffee shop,Open ⋅ Closes 10 PM
276,UBCN COFFEE SHOP,"788V+343, Area Sawah, Tlogoadi, Kec. Mlati, Kabupaten Sleman, Daerah Istimewa Yogyakarta 55286",2742883440,4.7,43,Coffee shop,Open ⋅ Closes 8 PM
277,UD Mitra / Coffee,"Jl. Seturan Raya No.189, Ngropoh, Condongcatur, Kec. Depok, Kabupaten Sleman, Daerah Istimewa Yogyakarta 55281",89688384225,4.4,594,Cafe,"{Monday, 8.00 am–11.00 pm; Tuesday, 8.00 am–11.00 pm; Wednesday, 8.00 am–11.00 pm; Thursday, 8.00 am–11.00 pm; Friday, 8.00 am–11.00 pm; Saturday, 8.00 am–11.00 pm; Sunday, 8.00 am–11.00 pm}"
278,UD. Djaya Coffee - Jakal,"Jl. Pandega Karya No.2, RT.011/RW.005, Manggung, Caturtunggal, Kec. Depok, Kabupaten Sleman, Daerah Istimewa Yogyakarta 55281",89651642722,4.9,967,Cafe,"{Monday, 7.00 am–12.00 am; Tuesday, 7.00 am–12.00 am; Wednesday, 7.00 am–12.00 am; Thursday, 7.00 am–12.00 am; Friday, 7.00 am–12.00 am; Saturday, 7.00 am–12.00 am; Sunday, 7.00 am–12.00 am}"
279,UMPAMA UII Coffee & Eatery,"Krawitan, Umbulmartani, Ngemplak, Sleman Regency, Special Region of Yogyakarta 55584, Indonesia",#ERROR!,4.8,437,Cafe,Open ⋅ Closes 3 AM
280,Volare Coffee,"Jl. Demangan Baru No.2, Demangan Baru, Caturtunggal, Kec. Depok, Kabupaten Sleman, Daerah Istimewa Yogyakarta 55281",82227177121,4.9,228,Cafe,"{Monday, 7.00 am–12.00 am; Tuesday, 7.00 am–12.00 am; Wednesday, 7.00 am–12.00 am; Thursday, 7.00 am–12.00 am; Friday, 7.00 am–12.00 am; Saturday, 7.00 am–12.00 am; Sunday, 7.00 am–12.00 am}"
281,Wardi Coffee Shop,"7CG3+9QQ, Dentan, Sinduharjo, Ngaglik, Sleman Regency, Special Region of Yogyakarta 55581, Indonesia",,4.7,3,Cafe,Open ⋅ Closes 5 PM
282,Warkop & Foto Copy “OMA”,"Jl. Magelang No.KM 11, Beran Lor, Tridadi, Sleman, Sleman Regency, Special Region of Yogyakarta 55511, Indonesia",#ERROR!,5,2,Coffee shop,Open ⋅ Closes 4 pm
283,Warkop Naik Kelas Demangan,"Jl. Beo No.3, Demangan Baru, Caturtunggal, Kec. Depok, Kabupaten Sleman, Daerah Istimewa Yogyakarta 55281",,4.6,355,Cafe,"{Monday, 9.00 am–11.00 pm; Tuesday, 9.00 am–11.00 pm; Wednesday, 9.00 am–11.00 pm; Thursday, 9.00 am–11.00 pm; Friday, 9.00 am–11.00 pm; Saturday, 9.00 am–11.00 pm; Sunday, 9.00 am–11.00 pm}"
284,Warna Kopi,"Jalan Palagan Tentara Pelajar Km 12,5 Gondanglutung, Gondong, Donoharjo, Ngaglik, Sleman Regency, Special Region of Yogyakarta 55581",81215248027,4.7,637,Coffee shop,Open ⋅ Closes 11 PM
285,Watu Langit Jogja Coffee and Resto,"Mlakon, Sambirejo, Prambanan, Sleman Regency, Special Region of Yogyakarta 55572",87738863338,4.6,"3,361",Coffee shop,Open ⋅ Closes 9 PM
286,Wohng Coffee,"8C99+VF2, Jl. Degolan, Legolan, Umbulmartani, Ngemplak, Sleman Regency, Special Region of Yogyakarta 55584, Indonesia",,4.8,55,Coffee shop,Open ⋅ Closes 11 PM
287,Wonderlust (Rebranding to ESCOPIA+),"Jl. Kranji, RT.05/RW.19, Randuguang, Sariharjo, Kec. Ngaglik, Kabupaten Sleman, Daerah Istimewa Yogyakarta 55581",87865447065,4.8,561,Cafe,"{Monday, 9.00 am–11.00 pm; Tuesday, 9.00 am–11.00 pm; Wednesday, 9.00 am–11.00 pm; Thursday, 12.00–11.00 pm; Friday, 9.00 am–11.00 pm; Saturday, 9.00 am–11.00 pm; Sunday, 9.00 am–11.00 pm}"
288,WONK Cafe,"Jl. Raya Wedomartani No.29A, RT.20/RW.67, Malangrejo, Sono Raya, Kec. Ngemplak, Kabupaten Sleman, Daerah Istimewa Yogyakarta 55584",81326696533,4.9,184,Cafe,"{Monday, 8.00 am–1.00 am; Tuesday, 8.00 am–1.00 am; Wednesday, 8.00 am–1.00 am; Thursday, 8.00 am–1.00 am; Friday, 8.00 am–2.00 am; Saturday, 8.00 am–2.00 am; Sunday, 8.00 am–1.00 am}"
289,Yellow Cafe & Milk,"79H5+RXJ, Jl. Turgo, Jaran, Tridadi, Kec. Sleman, Kabupaten Sleman, Daerah Istimewa Yogyakarta 55511",81908222188,4.2,42,Coffee shop,Open ⋅ Closes 11 PM
290,YOKOPI Yk,"Gadingan, Sinduharjo, Ngaglik, Sleman Regency, Special Region of Yogyakarta 55581, Indonesia",#ERROR!,5,19,Coffee shop,